[
  {
    "detected_at": "2026-02-22T16:05:02.092667+00:00",
    "venue": "binance",
    "market": "perp",
    "symbol": "ADA/USDT",
    "base": "ADA",
    "quote": "USDT",
    "mark_price": 0.2709,
    "funding_rate": -8.388e-05,
    "funding_rate_bps": -0.8388,
    "next_funding_time": "2026-02-23T00:00:00+00:00",
    "minutes_to_funding": 474.9651
  },
  {
    "detected_at": "2026-02-22T16:05:02.092667+00:00",
    "venue": "binance",
    "market": "perp",
    "symbol": "AVAX/USDT",
    "base": "AVAX",
    "quote": "USDT",
    "mark_price": 8.871,
    "funding_rate": -9.457e-05,
    "funding_rate_bps": -0.9457,
    "next_funding_time": "2026-02-23T00:00:00+00:00",
    "minutes_to_funding": 474.9651
  },
  {
    "detected_at": "2026-02-22T16:05:02.092667+00:00",
    "venue": "binance",
    "market": "perp",
    "symbol": "BNB/USDT",
    "base": "BNB",
    "quote": "USDT",
    "mark_price": 615.44080862,
    "funding_rate": 0.0,
    "funding_rate_bps": 0.0,
    "next_funding_time": "2026-02-23T00:00:00+00:00",
    "minutes_to_funding": 474.9651
  },
  {
    "detected_at": "2026-02-22T16:05:02.092667+00:00",
    "venue": "binance",
    "market": "perp",
    "symbol": "BTC/USDT",
    "base": "BTC",
    "quote": "USDT",
    "mark_price": 67609.2,
    "funding_rate": 5.093e-05,
    "funding_rate_bps": 0.5093,
    "next_funding_time": "2026-02-23T00:00:00+00:00",
    "minutes_to_funding": 474.9651
  },
  {
    "detected_at": "2026-02-22T16:05:02.092667+00:00",
    "venue": "binance",
    "market": "perp",
    "symbol": "DOGE/USDT",
    "base": "DOGE",
    "quote": "USDT",
    "mark_price": 0.09576,
    "funding_rate": -8.516e-05,
    "funding_rate_bps": -0.8516,
    "next_funding_time": "2026-02-23T00:00:00+00:00",
    "minutes_to_funding": 474.9651
  },
  {
    "detected_at": "2026-02-22T16:05:02.092667+00:00",
    "venue": "binance",
    "market": "perp",
    "symbol": "ETH/USDT",
    "base": "ETH",
    "quote": "USDT",
    "mark_price": 1952.14636434,
    "funding_rate": -4.485e-05,
    "funding_rate_bps": -0.4485,
    "next_funding_time": "2026-02-23T00:00:00+00:00",
    "minutes_to_funding": 474.9651
  },
  {
    "detected_at": "2026-02-22T16:05:02.092667+00:00",
    "venue": "binance",
    "market": "perp",
    "symbol": "LINK/USDT",
    "base": "LINK",
    "quote": "USDT",
    "mark_price": 8.70239042,
    "funding_rate": -4.21e-05,
    "funding_rate_bps": -0.421,
    "next_funding_time": "2026-02-23T00:00:00+00:00",
    "minutes_to_funding": 474.9651
  },
  {
    "detected_at": "2026-02-22T16:05:02.092667+00:00",
    "venue": "binance",
    "market": "perp",
    "symbol": "LTC/USDT",
    "base": "LTC",
    "quote": "USDT",
    "mark_price": 53.33,
    "funding_rate": 4.42e-06,
    "funding_rate_bps": 0.0442,
    "next_funding_time": "2026-02-23T00:00:00+00:00",
    "minutes_to_funding": 474.9651
  },
  {
    "detected_at": "2026-02-22T16:05:02.092667+00:00",
    "venue": "binance",
    "market": "perp",
    "symbol": "SOL/USDT",
    "base": "SOL",
    "quote": "USDT",
    "mark_price": 83.42,
    "funding_rate": -6.485e-05,
    "funding_rate_bps": -0.6485,
    "next_funding_time": "2026-02-23T00:00:00+00:00",
    "minutes_to_funding": 474.9651
  },
  {
    "detected_at": "2026-02-22T16:05:02.092667+00:00",
    "venue": "binance",
    "market": "perp",
    "symbol": "XRP/USDT",
    "base": "XRP",
    "quote": "USDT",
    "mark_price": 1.3935171,
    "funding_rate": -0.00012465,
    "funding_rate_bps": -1.2465,
    "next_funding_time": "2026-02-23T00:00:00+00:00",
    "minutes_to_funding": 474.9651
  },
  {
    "detected_at": "2026-02-22T16:05:02.092667+00:00",
    "venue": "bybit",
    "market": "perp",
    "symbol": "ADA/USDT",
    "base": "ADA",
    "quote": "USDT",
    "mark_price": 0.2709,
    "funding_rate": -0.00016323,
    "funding_rate_bps": -1.6323,
    "next_funding_time": "2026-02-23T00:00:00+00:00",
    "minutes_to_funding": 474.9651
  },
  {
    "detected_at": "2026-02-22T16:05:02.092667+00:00",
    "venue": "bybit",
    "market": "perp",
    "symbol": "AVAX/USDT",
    "base": "AVAX",
    "quote": "USDT",
    "mark_price": 8.873,
    "funding_rate": -0.00063933,
    "funding_rate_bps": -6.3933,
    "next_funding_time": "2026-02-23T00:00:00+00:00",
    "minutes_to_funding": 474.9651
  },
  {
    "detected_at": "2026-02-22T16:05:02.092667+00:00",
    "venue": "bybit",
    "market": "perp",
    "symbol": "BNB/USDT",
    "base": "BNB",
    "quote": "USDT",
    "mark_price": 614.9,
    "funding_rate": 4.347e-05,
    "funding_rate_bps": 0.4347,
    "next_funding_time": "2026-02-23T00:00:00+00:00",
    "minutes_to_funding": 474.9651
  },
  {
    "detected_at": "2026-02-22T16:05:02.092667+00:00",
    "venue": "bybit",
    "market": "perp",
    "symbol": "BTC/USDT",
    "base": "BTC",
    "quote": "USDT",
    "mark_price": 67601.28,
    "funding_rate": 5.94e-06,
    "funding_rate_bps": 0.0594,
    "next_funding_time": "2026-02-23T00:00:00+00:00",
    "minutes_to_funding": 474.9651
  },
  {
    "detected_at": "2026-02-22T16:05:02.092667+00:00",
    "venue": "bybit",
    "market": "perp",
    "symbol": "DOGE/USDT",
    "base": "DOGE",
    "quote": "USDT",
    "mark_price": 0.09575,
    "funding_rate": -3.685e-05,
    "funding_rate_bps": -0.3685,
    "next_funding_time": "2026-02-23T00:00:00+00:00",
    "minutes_to_funding": 474.9651
  },
  {
    "detected_at": "2026-02-22T16:05:02.092667+00:00",
    "venue": "bybit",
    "market": "perp",
    "symbol": "ETH/USDT",
    "base": "ETH",
    "quote": "USDT",
    "mark_price": 1951.99,
    "funding_rate": -6.997e-05,
    "funding_rate_bps": -0.6997,
    "next_funding_time": "2026-02-23T00:00:00+00:00",
    "minutes_to_funding": 474.9651
  },
  {
    "detected_at": "2026-02-22T16:05:02.092667+00:00",
    "venue": "bybit",
    "market": "perp",
    "symbol": "LINK/USDT",
    "base": "LINK",
    "quote": "USDT",
    "mark_price": 8.702,
    "funding_rate": 9.071e-05,
    "funding_rate_bps": 0.9071,
    "next_funding_time": "2026-02-23T00:00:00+00:00",
    "minutes_to_funding": 474.9651
  },
  {
    "detected_at": "2026-02-22T16:05:02.092667+00:00",
    "venue": "bybit",
    "market": "perp",
    "symbol": "LTC/USDT",
    "base": "LTC",
    "quote": "USDT",
    "mark_price": 53.32,
    "funding_rate": 7.504e-05,
    "funding_rate_bps": 0.7504,
    "next_funding_time": "2026-02-23T00:00:00+00:00",
    "minutes_to_funding": 474.9651
  },
  {
    "detected_at": "2026-02-22T16:05:02.092667+00:00",
    "venue": "bybit",
    "market": "perp",
    "symbol": "SOL/USDT",
    "base": "SOL",
    "quote": "USDT",
    "mark_price": 83.411,
    "funding_rate": -0.00011246,
    "funding_rate_bps": -1.1246,
    "next_funding_time": "2026-02-23T00:00:00+00:00",
    "minutes_to_funding": 474.9651
  },
  {
    "detected_at": "2026-02-22T16:05:02.092667+00:00",
    "venue": "bybit",
    "market": "perp",
    "symbol": "XRP/USDT",
    "base": "XRP",
    "quote": "USDT",
    "mark_price": 1.3933,
    "funding_rate": -0.0001379,
    "funding_rate_bps": -1.379,
    "next_funding_time": "2026-02-23T00:00:00+00:00",
    "minutes_to_funding": 474.9651
  }
]